{
  "schema_version": "0.1",
  "video_id": "Smpl0Gochu1",
  "title": "고추장 목살덮밥",
  "servings_raw": null,
  "ingredients": [
    { "name": "목살", "amount_raw": "200 g", "amount_status": "confirmed", "evidence": ["asr-0"] },
    { "name": "고추장", "amount_raw": "2큰술", "amount_status": "confirmed", "evidence": ["comment-0"] },
    { "name": "대파", "amount_raw": "1대", "amount_status": "confirmed", "evidence": ["comment-0"] },
    { "name": "기름", "amount_raw": "1큰술", "amount_status": "confirmed", "evidence": ["asr-2"] }
  ],
  "steps": [
    { "order": 1, "text": "목살을 굽는다.", "evidence": ["asr-0"] },
    { "order": 2, "text": "고추장을 넣고 볶는다.", "evidence": ["asr-1"] }
  ]
}
